{
  "$schema": "./contracts/release-manifest.schema.json",
  "schemaVersion": "1.0",
  "productVersion": "0.4.0-beta.6",
  "releaseDate": "2026-09-27",
  "channel": "beta",
  "minimumSupportedVersion": null,
  "releaseNotesUrl": "https://github.com/TheGoldenWave/Follow-up/releases/tag/v0.4.0-beta.6",
  "trustMode": "github-tag-sha256",
  "runtime": {
    "node": ">=20.0.0"
  },
  "acquisition": {
    "mode": "centralized",
    "feeds": [
      "x",
      "podcasts",
      "official-blogs",
      "newsletters",
      "academic-papers",
      "chinese-tech"
    ]
  },
  "capabilities": {
    "officialBlogs": true,
    "channelSelection": true,
    "candidatePool": true,
    "digestSelection": true,
    "deliveryLedger": true,
    "atMostOnceDelivery": true,
    "installer": true,
    "doctor": true,
    "localAcquisition": true,
    "sidecars": false,
    "longTermFeedback": false,
    "reports": false,
    "paginatedFeed": false,
    "explicitReadState": false,
    "automaticRollback": false,
    "updater": false
  },
  "integrity": {
    "trackedContent": {
      "algorithm": "git-ls-tree-sha256-v2",
      "digest": "a5ccc1a4e4ab2ed49b6d417fbf3aac10d5e255f30c6e2927ca50716dd8f68152"
    },
    "criticalFiles": {
      "algorithm": "sha256",
      "files": {
        "LICENSE": "3b1d30c9384a70f0f163fec07b83b0d410b3d7ab1273f1f9dd4a060e105f4da2",
        "SKILL.md": "765e5d4bb2a81e0441f8a99c37d69e9f9856d09f61194571a2195c1dc518a7c7",
        "THIRD_PARTY_NOTICES.md": "b167f01a0e79c75fe212f9c07ce8b8d113db7124aa11dce40abe8bc950104d2c",
        "VERSION": "38ab2e99078f4c2a8fe3a81e2ce445e3f6c63cd6ac9f5e361ff8b41cd7672a8a",
        "config/config-schema.json": "4ee4077f2326978ff9a7697b5998f2725d0c41547796afb2542f8459747fbb40",
        "config/sources.json": "065d9fce88d4cb9edd20e4713929ffbd7d7b68a65da7d9f0507ff38fc5779ea4",
        "contracts/candidate-feed.schema.json": "4cb63c9b4aa31d33d66672c334c680ca543d8921cbbeb9a6c6f640ce32c38f6c",
        "contracts/central-feed.schema.json": "555b2fa536db5a90989eea416ac01651d419e92934bbc11cc9b404694ab058d2",
        "contracts/checkpoint-commit-report.schema.json": "c1942c0278a5fadc1065d2276d91dfc1e17ef8e1289291d5f4862d9214b2301f",
        "contracts/checkpoint-intent.schema.json": "f177b525175d32b13480d2dda27009c36f54ade54b99729edfc069a5f93e9d24",
        "contracts/community-evidence.schema.json": "9f0db3a846fd0b3f068e3a07939cbaa27738f872122218ecd1fa741aebf836bd",
        "contracts/digest-curation-request.schema.json": "af4f261adcaaa9240da70013cc869fcd81372528edcc02c15c3ed404453df7d3",
        "contracts/digest-selection.schema.json": "5e08c383fe9755975e5e661f648d5a829e72f063f6dd42a8751aa7eecb121e3c",
        "contracts/release-manifest.schema.json": "0b8899a74eff74978fd2b772fac1f7ad56bc453c6c69d683cb40e70dd3bb2167",
        "contracts/review-candidates.schema.json": "cba51dad9891eb444db9ddf46b230e51cfebd9e88a14a8081699519a4a34b06e",
        "contracts/signal-batch.schema.json": "98d1764a53ffc4241ce4972977eaf79c243580579dc696799d97c346ff0aaa45",
        "contracts/v0.4-source-smoke.schema.json": "348bc6564a9dc23eaca740cd549c749b788e7b272dde64ac52e054bf4fb96a10",
        "docs/project-progress.md": "528ddb4e5fe2a9728c12dcbbdf65d983ae58a5a1a01991b4c0fab7b9ce957f65",
        "docs/source-catalog.md": "0ea374956d3b2b79f5dc3483d3d1eade0dd349cb47d0985b3d6244d5efc4c70f",
        "docs/third-party/v0.1.0-dependencies.md": "177423f7323b5d25b89773254b5adf59b20dd6836a86752e867a7a35c36ca290",
        "prompts/curate-digest.md": "76f256d6d4335f0bc414288557a3f11a4b7cb5671eb27cb396385cede7cbaeb8",
        "prompts/digest-intro.md": "5d25f2184b8bbacd910fcbe4547f02b83af76eb03f57f3b0bef02c8d2e1b91c5",
        "prompts/summarize-blogs.md": "58bfb1da427305b118ffcceabe8830f54566a142896e3c8605e556b98a5d2424",
        "prompts/summarize-newsletter.md": "8a5dac287bfc02707ce5d20669336a84e777692744ba12ab73ee47fd047b9514",
        "prompts/summarize-paper.md": "d1be88f1e315f0e6d3e6b48bab901573226668703878b117dc103b747b23ebf7",
        "prompts/summarize-podcast.md": "e9d6267b4b6b92b55aa813d22a91ecfe9e09bcb44586f030ce6f64477e11180a",
        "prompts/summarize-tweets.md": "e30e9f172a5673ccb9a6220d5379cdb69b42e1eb67194f9ebc493c88a5b18578",
        "prompts/summarize-zh-sources.md": "a1969b5f82b876be63f1d73100a316fc7e0b24a3eb147b9709d6da3a82192217",
        "prompts/translate.md": "96bd5896fa1792d95c0df189fbe92433f1bc50e5d7d49b71323a3afccf5f72ed",
        "pyproject.toml": "64fe6b2e96b73236cb1146d48be2dca5aed4a7971e90f981b6d10f941fa19685",
        "requirements-acquisition.lock": "7531ebd559ff17675ae1b12b55ca75098cfe08c2c20246132dcf72b77ce7a4b7",
        "requirements-build.lock": "caecbfde77fd224534cb679f5fa1a85a1b164575a384985ea7474bea34f11154",
        "scripts/bootstrap-acquisition.js": "646915d1ceab8f2c2966d033bc34ed416309b8adb701942c75e44a561945fbc9",
        "scripts/candidate-feed-contract.js": "a1ea1c5ea157efc2a838f5edfe5168b9181bf5e33000077189f277f4edbf0e2f",
        "scripts/candidate-feed-store.js": "6c3661364c5ca0d9012890e21f640f631116314d5261ad73adca87e74c186351",
        "scripts/candidate-identity.js": "333dd5c83e6cf49256abcb4a951f7756a305dbc1016089715bf26fe1932cb388",
        "scripts/candidate-normalization.js": "1139d3ec14bcd6e0c1e56be43662b5bb6213893dc7de282fc4cb2ff2d5fde7d9",
        "scripts/collect-and-prepare.js": "1a1d1fa63e66382644100b6a0e73f12723d3f8eb7066be3c992950322af1e229",
        "scripts/command-line.js": "2ec8a255c70d2893f559dab95f87e136ca29b68a37d0b101c5ca1dd9ba27c24f",
        "scripts/community-evidence-contract.js": "ee582e2484603dae98f1c33504a6e8b988947be310bece211942dd2a1e5baa8c",
        "scripts/config-contract.js": "8bf9bcb5eec8b9c48903a8eb8c2de0c81b10a18a9929708178206a4794a3494a",
        "scripts/deliver.js": "8d2d44a33cb61cbd36fb36093cee2abf409008a3878dcc4087ac0f031cdeb68f",
        "scripts/delivery-ledger.js": "833d4c74f2522ff56f9d72cce8e917d3dda2a4fae54f82d5614930ee25a2e297",
        "scripts/delivery-message.js": "89c0dc4b89ae83898df512a3aba10d034d16f07dba8b2feeecb98ba6548fe3d0",
        "scripts/delivery-outbox.js": "1bcd987c15a1680f899344ffa53470f3178d287860954f73df1f3f95035701c5",
        "scripts/delivery-providers.js": "a1151b65245bd13dbdfa8fa10d924549ac0ce1d08fd40d31cb831fe6e901429e",
        "scripts/digest-candidates.js": "aa988d75e5e110bb6823fdaf59e5669f7e3eb188ee4f9b1d10b21e3716124a6b",
        "scripts/digest-selection-contract.js": "1aaf486d6a0394746e317e14dc318b8f85dc9cb4f9b247570ba1bd3a955f7391",
        "scripts/digest-selection.js": "d4788ccb92365da736437b651dbbbb0cb417542a03fde532935e5d9a338b7825",
        "scripts/digest-window.js": "08001ab89cb003e27847af5fcb4ec8aa1b173eb2d6ebd25438d3988f3949fe8e",
        "scripts/doctor.js": "ef76c0d62fb1592101ad5b2591268235e6eb8646f4962b74eb8e4410cc674c17",
        "scripts/feed-contract.js": "63bda68219ad37aa68131161a6e2e40a07776b7b8dda508ccf838a6e5f760dbd",
        "scripts/finalize-digest.js": "523c01c9fc80bdbb7acac565484f51e77e2d18cd12598dc490cd2e455322d1de",
        "scripts/install.js": "46e94583a811d4f785bbd4c79f95be5125e32a572e9dd2dce7d4b970c8aff1a6",
        "scripts/lib/acquisition-retention.js": "ac0b5878124cad96a9752ff213bcb2a32ca431b25d35b3505a35f497dfb6c2a0",
        "scripts/lib/checkpoint-intent.js": "7a30081ae45828d6f80be09c2d1643aae314d264717d70e9b9c9bdc6ad06dcad",
        "scripts/lib/diagnostics.js": "d926ae9a027f6b82ec6f88a1bac0aebc4dd653d690482d867355e2a02fc997d8",
        "scripts/lib/install-worker.js": "7a621798b4cb5ea2f756c869df746dc03bdb169b2cccdead21a151584ec9b47f",
        "scripts/lib/load-signal-batches.js": "a2b7cbd90325c232ea34989a06b4a23a0ea7ad6e7ca5a2033233f3514a8e78fa",
        "scripts/lib/local-candidate-store.js": "4c2496bbfa8a093f8c569562a3fc8661227e3bae4b92ea3973c85366363d4e97",
        "scripts/lib/migration-metrics.js": "5f481f665fb4749accd5857c69917176ae40a4458330f7beb181149ac970faa8",
        "scripts/lib/migration-state.js": "78db0a36833fa100d000b27872a5ed7282e2029aef74886baff3fef5773e9497",
        "scripts/lib/normalize-central-feeds.js": "77659e97eb82c51dcb95b98710a790e63aeb231ac986521f5b124afed229dc07",
        "scripts/lib/paths.js": "6f14445b5ebc797cdc48f938429fcd6ace05d7c84ccd404368398bde53fd58d1",
        "scripts/lib/publish-batches.js": "0d9ee6922f8fadc02d224aa4ca999029e3483155e61340e735524dbd02c7bf8b",
        "scripts/lib/resolve-acquisition-input.js": "4b300b2f0819fbcb52db84fed54d8fc0dc96a8601b1bff634edfae97007a3daa",
        "scripts/lib/review-queue.js": "cb5ab837c81d0522dca0177f808b6fc2c896837b4db3dea98a1f7744b1e9b4af",
        "scripts/lib/route-channels.js": "dfc0d79acfaffa3a1c8886f7a952b33c145e262e4e4257644f5886b9451c98fe",
        "scripts/lib/run-acquisition.js": "c16bdd1a3d8eaa6576ccc49f471261b193c4f2fbb0681e500a618be687ed4229",
        "scripts/lib/skill-registration.js": "ca30a2fb33880c9d0cfa64d86aad1035c79883579cdea8825da4708bf92c6d94",
        "scripts/migration.js": "1ee14b57fc8f2a81d7e569d1e07f9f23b7839a0221d427336b065fa3c28beb6f",
        "scripts/package-lock.json": "ad47d9ab6fd013f2e0678637635b8721b62da406aac0207126b1828e410b3200",
        "scripts/package.json": "8d70b33b9459a5d808fcab07c54a633c92121dc4b868a9a9c987019af5a44c6c",
        "scripts/prepare-digest.js": "10ac31a7302d82ca93c0caa097bc07a8ff0569c82d37b783e854208694cc73e9",
        "scripts/release/build-release.sh": "dd7153a86876e78dcf45ffb76f82aa7a2d078a9ddfe3069a5634af33203a3c50",
        "scripts/release/check-provenance.js": "a8faf3a4d809c820d45012e3e3f58881dc7cdbe09e9ebd7af49d1fa5f9eea437",
        "scripts/release/scan-secrets.js": "03c239bccbe497d700ec3c3ed74b8e0c67216d274c6cc3652b871e4b08749482",
        "scripts/release/validate-release.js": "d11329ca4b2620674c8d00e1f052f0433a151afc4ccd8318c08f58ce9f53a0c7",
        "scripts/release/verify-dependency-licenses.js": "f4b2603095df4651a54f7deeee741b697301a9672ee1c48cf61f8419325f1572",
        "scripts/release/verify-v0.4-source-smoke.js": "a568874744969b058eec3d8582913781816d88943d0fdbaa6b0aa282aaee6476",